{
  "schema_version": 2,
  "run_id": "2026-10-15T19-40-53Z_claude-opus-5_71c0af1",
  "git_sha": "71c0af1",
  "suite_sha256": "53e73c4c1c51ddd0504e56c5c846e045adb558be22caf04149de0496f005e0c6",
  "prompt_sha256": "54f40b71305156903be5073d0569eaa7ccfa18599cae994badec4d1593ebfcc8",
  "mode": "replay",
  "trials": 1,
  "temperature": null,
  "generated_at": "2026-10-15T19:40:53.230631+00:00",
  "accuracy": 0.7636363636363637,
  "accuracy_ci": [
    0.6365163381083228,
    0.8563334413026682
  ],
  "false_ships": 0.03636363636363636,
  "false_blocks": 0.0,
  "by_flaw": {
    "clean": 1.0,
    "novelty": 0.9,
    "outliers": 1.0,
    "peeking": 0.0,
    "simpson": 0.9,
    "srm": 0.9
  },
  "models": [
    {
      "name": "claude-opus-5 (tools)",
      "accuracy": 0.7636363636363637
    },
    {
      "name": "claude-opus-5 (no tools)",
      "accuracy": 0.45454545454545453
    }
  ],
  "variants": [
    {
      "label": "claude-opus-5 (tools)",
      "model": "claude-opus-5",
      "tools": true,
      "accuracy": 0.7636363636363637,
      "accuracy_ci": [
        0.6365163381083228,
        0.8563334413026682
      ],
      "accuracy_by_trial": [
        0.7636363636363637
      ],
      "pass_at_k": 0.7636363636363637,
      "pass_hat_k": 0.7636363636363637,
      "false_ships": 0.03636363636363636,
      "false_blocks": 0.0,
      "by_flaw": {
        "clean": {
          "acc": 1.0,
          "ci": [
            0.7224672001371107,
            1.0
          ],
          "n": 10
        },
        "novelty": {
          "acc": 0.9,
          "ci": [
            0.5958499732047615,
            0.9821237869049271
          ],
          "n": 10
        },
        "outliers": {
          "acc": 1.0,
          "ci": [
            0.5655175352168251,
            1.0
          ],
          "n": 5
        },
        "peeking": {
          "acc": 0.0,
          "ci": [
            0.0,
            0.2775327998628892
          ],
          "n": 10
        },
        "simpson": {
          "acc": 0.9,
          "ci": [
            0.5958499732047615,
            0.9821237869049271
          ],
          "n": 10
        },
        "srm": {
          "acc": 0.9,
          "ci": [
            0.5958499732047615,
            0.9821237869049271
          ],
          "n": 10
        }
      },
      "errors": {
        "missed_flaw": 11,
        "false_ship": 2
      },
      "process": {
        "srm_checked_before_lift": 1.0
      },
      "cost_usd": {
        "total": null,
        "per_case_mean": null
      },
      "latency_s": {
        "p50": 0.0173532500048168,
        "p95": 0.06183951681596227
      },
      "tokens": {
        "input": null,
        "output": null
      }
    },
    {
      "label": "claude-opus-5 (no tools)",
      "model": "claude-opus-5",
      "tools": false,
      "accuracy": 0.45454545454545453,
      "accuracy_ci": [
        0.33025280252016564,
        0.5847730975813876
      ],
      "accuracy_by_trial": [
        0.45454545454545453
      ],
      "pass_at_k": 0.45454545454545453,
      "pass_hat_k": 0.45454545454545453,
      "false_ships": 0.0,
      "false_blocks": 0.0,
      "by_flaw": {
        "clean": {
          "acc": 1.0,
          "ci": [
            0.7224672001371107,
            1.0
          ],
          "n": 10
        },
        "novelty": {
          "acc": 0.0,
          "ci": [
            0.0,
            0.2775327998628892
          ],
          "n": 10
        },
        "outliers": {
          "acc": 1.0,
          "ci": [
            0.5655175352168251,
            1.0
          ],
          "n": 5
        },
        "peeking": {
          "acc": 0.0,
          "ci": [
            0.0,
            0.2775327998628892
          ],
          "n": 10
        },
        "simpson": {
          "acc": 1.0,
          "ci": [
            0.7224672001371107,
            1.0
          ],
          "n": 10
        },
        "srm": {
          "acc": 0.0,
          "ci": [
            0.0,
            0.2775327998628892
          ],
          "n": 10
        }
      },
      "errors": {
        "skipped_srm_check": 10,
        "missed_flaw": 20
      },
      "process": {
        "srm_checked_before_lift": 0.0
      },
      "cost_usd": {
        "total": null,
        "per_case_mean": null
      },
      "latency_s": {
        "p50": 0.005459250009153038,
        "p95": 0.006205370527459308
      },
      "tokens": {
        "input": null,
        "output": null
      }
    }
  ],
  "comparisons": [
    {
      "a": "claude-opus-5 (tools)",
      "b": "claude-opus-5 (no tools)",
      "b_only_a_right": 18,
      "c_only_b_right": 1,
      "p_value": 7.62939453125e-05,
      "method": "exact"
    }
  ],
  "cases": [
    {
      "id": "srm-01",
      "flaw": "srm",
      "truth": "INVALID",
      "variant": "claude-opus-5 (tools)",
      "model": "claude-opus-5",
      "trial": 0,
      "verdict": "INVALID",
      "correct": true,
      "error": null,
      "srm_checked_before_lift": true,
      "latency_s": 0.023147874977439642,
      "input_tokens": null,
      "output_tokens": null,
      "trajectory": [
        {
          "turn": 0,
          "act": "check_srm",
          "body": {
            "args": {
              "ratio": 1.0,
              "control": false,
              "alpha": 0.001,
              "by": []
            },
            "result": {
              "mismatch": true,
              "p_value": 1.875064732600709e-68,
              "counts": [
                [
                  "False",
                  24990
                ],
                [
                  "True",
                  21230
                ]
              ],
              "strata": []
            }
          }
        },
        {
          "turn": 1,
          "act": "verdict",
          "body": "VERDICT: INVALID. The traffic split doesn't match the assigned ratio."
        }
      ],
      "cost_usd": null
    },
    {
      "id": "srm-02",
      "flaw": "srm",
      "truth": "INVALID",
      "variant": "claude-opus-5 (tools)",
      "model": "claude-opus-5",
      "trial": 0,
      "verdict": "INVALID",
      "correct": true,
      "error": null,
      "srm_checked_before_lift": true,
      "latency_s": 0.011559583013877273,
      "input_tokens": null,
      "output_tokens": null,
      "trajectory": [
        {
          "turn": 0,
          "act": "check_srm",
          "body": {
            "args": {
              "ratio": 1.0,
              "control": false,
              "alpha": 0.001,
              "by": []
            },
            "result": {
              "mismatch": true,
              "p_value": 6.207007639686053e-73,
              "counts": [
                [
                  "False",
                  25035
                ],
                [
                  "True",
                  21152
                ]
              ],
              "strata": []
            }
          }
        },
        {
          "turn": 1,
          "act": "verdict",
          "body": "VERDICT: INVALID. The traffic split doesn't match the assigned ratio."
        }
      ],
      "cost_usd": null
    },
    {
      "id": "srm-03",
      "flaw": "srm",
      "truth": "INVALID",
      "variant": "claude-opus-5 (tools)",
      "model": "claude-opus-5",
      "trial": 0,
      "verdict": "NO_EFFECT",
      "correct": false,
      "error": "missed_flaw",
      "srm_checked_before_lift": true,
      "latency_s": 0.02461008302634582,
      "input_tokens": null,
      "output_tokens": null,
      "trajectory": [
        {
          "turn": 0,
          "act": "check_srm",
          "body": {
            "args": {
              "ratio": 1.0,
              "control": false,
              "alpha": 0.001,
              "by": []
            },
            "result": {
              "mismatch": true,
              "p_value": 4.415639923546449e-65,
              "counts": [
                [
                  "False",
                  24960
                ],
                [
                  "True",
                  21295
                ]
              ],
              "strata": []
            }
          }
        },
        {
          "turn": 1,
          "act": "check_guardrails",
          "body": {
            "args": {
              "guardrails": [],
              "control": false,
              "alpha": 0.01
            },
            "result": {
              "statuses": [],
              "bounds": [],
              "blocks_ship": false
            }
          }
        },
        {
          "turn": 2,
          "act": "analyze",
          "body": {
            "args": {
              "cuped": false,
              "covariate": null,
              "control": false,
              "alpha": 0.05,
              "mde": null,
              "unit": null
            },
            "result": {
              "p_value": 0.6687133200769045,
              "lift": -0.010720736477025428,
              "ci_low": -0.058395661338636384,
              "ci_high": 0.03936804563570173,
              "width": 0.09776370697433812,
              "equivalent_to_null": null,
              "mde": null,
              "unit_of_analysis": "row",
              "rows_per_unit": 1.0
            }
          }
        },
        {
          "turn": 3,
          "act": "verdict",
          "body": "VERDICT: NO_EFFECT. No significant effect on the primary metric."
        }
      ],
      "cost_usd": null
    },
    {
      "id": "srm-04",
      "flaw": "srm",
      "truth": "INVALID",
      "variant": "claude-opus-5 (tools)",
      "model": "claude-opus-5",
      "trial": 0,
      "verdict": "INVALID",
      "correct": true,
      "error": null,
      "srm_checked_before_lift": true,
      "latency_s": 0.009205416950862855,
      "input_tokens": null,
      "output_tokens": null,
      "trajectory": [
        {
          "turn": 0,
          "act": "check_srm",
          "body": {
            "args": {